{
  "all_attempt_ids": [
    "EXP-CASE-006-ARM-A-R2-A01"
  ],
  "anonymous_arm_id": "ARM-A",
  "attempt_count": 1,
  "case_id": "CASE-006",
  "censored": false,
  "confidence": "HIGH",
  "elapsed_seconds": 195.816241,
  "evidence_ids": [
    "CLASSIFICATION:EXP-CASE-006-ARM-A-R2-A01"
  ],
  "first_attempt_id": "EXP-CASE-006-ARM-A-R2-A01",
  "first_completion_id": null,
  "first_eligible_success_id": null,
  "hard_failure_count": 1,
  "harness_failure_ids": [],
  "infrastructure_failure_ids": [],
  "input_tokens": 272127,
  "oracle_fail_count": 0,
  "oracle_pass_count": 0,
  "outcome_resolution": "RESOLVED_TERMINAL_NEGATIVE",
  "outcome_subtype": "POLICY_FAILURE",
  "output_tokens": 9181,
  "policy_violation_count": 1,
  "quality_eligible": false,
  "reliability_eligible": true,
  "repeat_id": 2,
  "retry_count": 0,
  "scheduled_order": 1,
  "schema_version": "1.0.0",
  "selected_quality_record_id": null,
  "slot_hash": "ab4f0d81422f236f83960906efffbfcaa5c7cf86098a2429b77a672662131cba",
  "slot_id": "CASE-006-ARM-A-R2",
  "terminal_failure_ids": [
    "EXP-CASE-006-ARM-A-R2-A01"
  ],
  "unresolved_reason": null
}
