{
  "all_attempt_ids": [
    "EXP-CASE-001-ARM-A-R2-A01",
    "EXP-CASE-001-ARM-A-R2-A02",
    "EXP-CASE-001-ARM-A-R2-A03"
  ],
  "anonymous_arm_id": "ARM-A",
  "attempt_count": 3,
  "case_id": "CASE-001",
  "censored": true,
  "confidence": "LOW",
  "elapsed_seconds": 650.793894,
  "evidence_ids": [
    "CLASSIFICATION:EXP-CASE-001-ARM-A-R2-A01",
    "CLASSIFICATION:EXP-CASE-001-ARM-A-R2-A02",
    "CLASSIFICATION:EXP-CASE-001-ARM-A-R2-A03"
  ],
  "first_attempt_id": "EXP-CASE-001-ARM-A-R2-A01",
  "first_completion_id": "EXP-CASE-001-ARM-A-R2-A01",
  "first_eligible_success_id": null,
  "hard_failure_count": 3,
  "harness_failure_ids": [
    "EXP-CASE-001-ARM-A-R2-A01",
    "EXP-CASE-001-ARM-A-R2-A03"
  ],
  "infrastructure_failure_ids": [
    "EXP-CASE-001-ARM-A-R2-A02"
  ],
  "input_tokens": 639486,
  "oracle_fail_count": 2,
  "oracle_pass_count": 1,
  "outcome_resolution": "CENSORED_HARNESS",
  "outcome_subtype": "HARNESS_FILE_BINDING_MISMATCH",
  "output_tokens": 29470,
  "policy_violation_count": 0,
  "quality_eligible": false,
  "reliability_eligible": true,
  "repeat_id": 2,
  "retry_count": 2,
  "scheduled_order": 1,
  "schema_version": "1.0.0",
  "selected_quality_record_id": null,
  "slot_hash": "c0d252ddf8f1962d589d75635841e7cad516f70688330146cdfb1f848aa855d4",
  "slot_id": "CASE-001-ARM-A-R2",
  "terminal_failure_ids": [],
  "unresolved_reason": "HARNESS_SEMANTIC_EQUIVALENCE_NOT_ESTABLISHED"
}
